{
  "event_id": "ffffffff-ffff-4fff-8fff-ffffffffffff",
  "event_type": "DOCUMENT_ENRICHMENT_REQUESTED",
  "schema_version": 1,
  "occurred_at": "2026-08-02T10:22:00Z",
  "producer": "projection-worker",
  "correlation_id": "aaaaaaaa-aaaa-4aaa-8aaa-aaaaaaaaaaaa",
  "causation_id": "11111111-1111-4111-8111-111111111111",
  "aggregate_type": "document",
  "aggregate_id": "11111111-1111-4111-8111-111111111111",
  "payload": {
    "document_id": "11111111-1111-4111-8111-111111111111",
    "run_id": "22222222-2222-4222-8222-222222222222",
    "revision": 1,
    "chunk_count": 12
  }
}
