{
  "event_id": "cccccccc-cccc-4ccc-8ccc-cccccccccccc",
  "event_type": "CONTENT_GENERATION_STARTED",
  "schema_version": 1,
  "occurred_at": "2026-08-02T11:10:00Z",
  "producer": "content-generation-worker",
  "correlation_id": "aaaaaaaa-aaaa-4aaa-8aaa-aaaaaaaaaaaa",
  "causation_id": "22222222-2222-4222-8222-222222222222",
  "aggregate_type": "content_generation_request",
  "aggregate_id": "55555555-5555-4555-8555-555555555555",
  "payload": {
    "request_id": "55555555-5555-4555-8555-555555555555",
    "course_id": "33333333-3333-4333-8333-333333333333"
  }
}
