{
  "event_id": "33333333-3333-4333-8333-333333333333",
  "event_type": "DOCUMENT_DELETED",
  "schema_version": 1,
  "occurred_at": "2026-08-02T10:10:00Z",
  "producer": "core-api",
  "correlation_id": "aaaaaaaa-aaaa-4aaa-8aaa-aaaaaaaaaaaa",
  "causation_id": "bbbbbbbb-bbbb-4bbb-8bbb-bbbbbbbbbbbb",
  "aggregate_type": "document",
  "aggregate_id": "11111111-1111-4111-8111-111111111111",
  "payload": {
    "document_id": "11111111-1111-4111-8111-111111111111",
    "active_run_id": "22222222-2222-4222-8222-222222222222",
    "revision": 1,
    "storage_key": "documents/2026/08/lecture.pdf",
    "deleted_at": "2026-08-02T10:10:00Z"
  }
}
