{
  "event_id": "77777777-7777-4777-8777-777777777777",
  "event_type": "DOCUMENT_ENRICHMENT_STARTED",
  "schema_version": 1,
  "occurred_at": "2026-08-02T10:40:00Z",
  "producer": "enrichment-worker",
  "correlation_id": "aaaaaaaa-aaaa-4aaa-8aaa-aaaaaaaaaaaa",
  "causation_id": "11111111-1111-4111-8111-111111111111",
  "aggregate_type": "document",
  "aggregate_id": "11111111-1111-4111-8111-111111111111",
  "payload": {
    "document_id": "11111111-1111-4111-8111-111111111111",
    "run_id": "22222222-2222-4222-8222-222222222222",
    "revision": 1
  }
}
