{
  "event_id": "88888888-8888-4888-8888-888888888888",
  "event_type": "DOCUMENT_ENRICHMENT_COMPLETED",
  "schema_version": 1,
  "occurred_at": "2026-08-02T10:50:00Z",
  "producer": "enrichment-worker",
  "correlation_id": "aaaaaaaa-aaaa-4aaa-8aaa-aaaaaaaaaaaa",
  "causation_id": "11111111-1111-4111-8111-111111111111",
  "aggregate_type": "document",
  "aggregate_id": "11111111-1111-4111-8111-111111111111",
  "payload": {
    "document_id": "11111111-1111-4111-8111-111111111111",
    "run_id": "22222222-2222-4222-8222-222222222222",
    "revision": 1,
    "generated_count": 3,
    "artifact": {
      "bucket": "ai-artifacts",
      "key": "document-enrichment/11111111-1111-4111-8111-111111111111/22222222-2222-4222-8222-222222222222.json.gz",
      "sha256": "9f86d081884c7d659a2feaa0c55ad015a3bf4f1b2b0b822cd15d6c15b0f00a08",
      "compressed_size": 2048,
      "uncompressed_size": 10240,
      "content_encoding": "gzip",
      "media_type": "application/json",
      "schema_version": 1
    }
  }
}
