{
  "event_id": "44444444-4444-4444-8444-444444444444",
  "event_type": "DOCUMENT_PROCESSING_PROGRESS",
  "schema_version": 1,
  "occurred_at": "2026-08-02T10:20:00Z",
  "producer": "document-worker",
  "correlation_id": "aaaaaaaa-aaaa-4aaa-8aaa-aaaaaaaaaaaa",
  "causation_id": "11111111-1111-4111-8111-111111111111",
  "aggregate_type": "document",
  "aggregate_id": "11111111-1111-4111-8111-111111111111",
  "payload": {
    "document_id": "11111111-1111-4111-8111-111111111111",
    "run_id": "22222222-2222-4222-8222-222222222222",
    "revision": 1,
    "sequence": 40,
    "status": "INDEXED"
  }
}
