{
  "event_id": "aaaaaaaa-aaaa-4aaa-8aaa-aaaaaaaaaaaa",
  "event_type": "DOCUMENT_AI_CLEANUP_COMPLETED",
  "schema_version": 1,
  "occurred_at": "2026-08-02T11:00:00Z",
  "producer": "projection-worker",
  "correlation_id": "aaaaaaaa-aaaa-4aaa-8aaa-aaaaaaaaaaaa",
  "causation_id": "33333333-3333-4333-8333-333333333333",
  "aggregate_type": "document",
  "aggregate_id": "11111111-1111-4111-8111-111111111111",
  "payload": {
    "document_id": "11111111-1111-4111-8111-111111111111",
    "revision": 1,
    "cleaned_at": "2026-08-02T11:00:00Z"
  }
}
