{
  "event_id": "11111111-1111-4111-8111-111111111111",
  "event_type": "DOCUMENT_PROCESSING_REQUESTED",
  "schema_version": 1,
  "occurred_at": "2026-08-02T10:00:00Z",
  "producer": "core-api",
  "correlation_id": "aaaaaaaa-aaaa-4aaa-8aaa-aaaaaaaaaaaa",
  "causation_id": "bbbbbbbb-bbbb-4bbb-8bbb-bbbbbbbbbbbb",
  "aggregate_type": "document",
  "aggregate_id": "11111111-1111-4111-8111-111111111111",
  "payload": {
    "document_id": "11111111-1111-4111-8111-111111111111",
    "run_id": "22222222-2222-4222-8222-222222222222",
    "revision": 1,
    "storage_key": "documents/2026/08/lecture.pdf",
    "file_name": "lecture.pdf",
    "mime_type": "application/pdf",
    "language": "vi",
    "course_id": "33333333-3333-4333-8333-333333333333",
    "owner_id": "44444444-4444-4444-8444-444444444444",
    "checksum": "9f86d081884c7d659a2feaa0c55ad015a3bf4f1b2b0b822cd15d6c15b0f00a08"
  }
}
